{
  "schema_version": 1,
  "kind": "idea_spec",
  "idea_id": "signed_trade_pressure",
  "campaign_id": "sfm_stream_001",
  "family_id": "flow_pressure",
  "title": "Signed trade pressure",
  "source": {"type": "market_observation", "reference": "trade direction and volume", "retrieved_at": "2026-08-26"},
  "hypothesis": {"mechanism": "Persistent aggressive trade imbalance may reveal short-horizon demand pressure.", "expected_sign": "raw_signed", "falsifiable_condition": "The signal has no stable relation to the next evaluation return on formal history."},
  "inputs": {"streams": ["trade"], "fields": ["trade_volume", "bsflag", "trade_type"]},
  "operators": [
    {"operator_id": "signed_trade_flow", "description": "Signed trade volume divided by absolute trade volume.", "representative": true},
    {"operator_id": "trade_flow_zscore", "description": "Signed trade flow standardized by rolling dispersion.", "representative": false},
    {"operator_id": "decayed_trade_flow", "description": "Signed trade flow with event-time exponential decay.", "representative": false}
  ],
  "parameter_space": {"window_events": [16, 32, 64, 128], "normalization": ["signed_total_volume", "none"], "include_cancels": [false]},
  "state": {"window_type": "event_count", "warmup_events": 1, "reset_policy": "trading_day"},
  "availability": {"update_on": ["trade"], "output_at": "scheduled_snapshot", "lag_events": 0, "invalid_policy": "finite_or_zero"},
  "implementation": {"language": "cpp", "target_path": "base/hf-open5m-factor-demo/factors/flow_pressure/factor_entry.cpp", "complexity": "O(1) amortized per trade"},
  "representative_candidate_id": "flow_pressure_signed_trade_flow_w16"
}
